number,value,datetime_start,datetime_complete,duration,params_max_depth,params_max_features,params_min_samples_leaf,params_min_samples_split,state
0,0.8018867924528302,2026-07-08 15:58:13.735647,2026-07-08 15:58:13.735647,0 days 00:00:00,10,log2,5,2,COMPLETE
1,0.8018867924528302,2026-07-08 15:58:13.735647,2026-07-08 15:58:13.735647,0 days 00:00:00,100,log2,5,2,COMPLETE
2,0.8018867924528302,2026-07-08 15:58:13.735647,2026-07-08 15:58:13.735647,0 days 00:00:00,1000,sqrt,5,2,COMPLETE
3,0.8018867924528302,2026-07-08 15:58:13.735647,2026-07-08 15:58:13.735647,0 days 00:00:00,100,log2,5,2,COMPLETE
4,0.8018867924528302,2026-07-08 15:58:13.735647,2026-07-08 15:58:13.735647,0 days 00:00:00,1000,sqrt,5,10,COMPLETE
5,0.7358490566037735,2026-07-08 15:58:13.735647,2026-07-08 15:58:13.751566,0 days 00:00:00.015919,100,sqrt,1,10,COMPLETE
6,0.7358490566037735,2026-07-08 15:58:13.751566,2026-07-08 15:58:13.751566,0 days 00:00:00,100,log2,1,10,COMPLETE
7,0.7358490566037735,2026-07-08 15:58:13.751566,2026-07-08 15:58:13.751566,0 days 00:00:00,1000,sqrt,1,10,COMPLETE
8,0.7264150943396226,2026-07-08 15:58:13.751566,2026-07-08 15:58:13.751566,0 days 00:00:00,1000,sqrt,1,2,COMPLETE
9,0.8018867924528302,2026-07-08 15:58:13.751566,2026-07-08 15:58:13.751566,0 days 00:00:00,1000,sqrt,5,2,COMPLETE
10,0.8018867924528302,2026-07-08 15:58:13.751566,2026-07-08 15:58:13.751566,0 days 00:00:00,10,log2,5,2,COMPLETE
11,0.8018867924528302,2026-07-08 15:58:13.767315,2026-07-08 15:58:13.767315,0 days 00:00:00,10,log2,5,2,COMPLETE
12,0.8018867924528302,2026-07-08 15:58:13.767315,2026-07-08 15:58:13.767315,0 days 00:00:00,10,log2,5,2,COMPLETE
13,0.8018867924528302,2026-07-08 15:58:13.767315,2026-07-08 15:58:13.767315,0 days 00:00:00,10,log2,5,2,COMPLETE
14,0.8018867924528302,2026-07-08 15:58:13.767315,2026-07-08 15:58:13.767315,0 days 00:00:00,100,log2,5,2,COMPLETE
15,0.8018867924528302,2026-07-08 15:58:13.767315,2026-07-08 15:58:13.783106,0 days 00:00:00.015791,10,log2,5,2,COMPLETE
16,0.8018867924528302,2026-07-08 15:58:13.783106,2026-07-08 15:58:13.783106,0 days 00:00:00,100,log2,5,2,COMPLETE
17,0.8018867924528302,2026-07-08 15:58:13.783106,2026-07-08 15:58:13.783106,0 days 00:00:00,100,log2,5,2,COMPLETE
18,0.7358490566037735,2026-07-08 15:58:13.783106,2026-07-08 15:58:13.783106,0 days 00:00:00,10,log2,1,10,COMPLETE
19,0.8018867924528302,2026-07-08 15:58:13.783106,2026-07-08 15:58:13.799310,0 days 00:00:00.016204,10,log2,5,2,COMPLETE
20,0.8018867924528302,2026-07-08 15:58:13.799310,2026-07-08 15:58:13.799310,0 days 00:00:00,100,log2,5,2,COMPLETE
21,0.8018867924528302,2026-07-08 15:58:13.799310,2026-07-08 15:58:13.799310,0 days 00:00:00,1000,sqrt,5,2,COMPLETE
22,0.8018867924528302,2026-07-08 15:58:13.799310,2026-07-08 15:58:13.799310,0 days 00:00:00,1000,sqrt,5,2,COMPLETE
23,0.8018867924528302,2026-07-08 15:58:13.799310,2026-07-08 15:58:13.815087,0 days 00:00:00.015777,1000,sqrt,5,2,COMPLETE
24,0.8018867924528302,2026-07-08 15:58:13.815087,2026-07-08 15:58:13.815087,0 days 00:00:00,10,sqrt,5,2,COMPLETE
25,0.8018867924528302,2026-07-08 15:58:13.815087,2026-07-08 15:58:13.815087,0 days 00:00:00,100,log2,5,2,COMPLETE
26,0.7358490566037735,2026-07-08 15:58:13.815087,2026-07-08 15:58:13.815087,0 days 00:00:00,1000,sqrt,1,10,COMPLETE
27,0.8018867924528302,2026-07-08 15:58:13.815087,2026-07-08 15:58:13.830903,0 days 00:00:00.015816,10,log2,5,2,COMPLETE
28,0.8018867924528302,2026-07-08 15:58:13.830903,2026-07-08 15:58:13.830903,0 days 00:00:00,1000,sqrt,5,2,COMPLETE
29,0.8018867924528302,2026-07-08 15:58:13.830903,2026-07-08 15:58:13.830903,0 days 00:00:00,100,log2,5,2,COMPLETE
30,0.8018867924528302,2026-07-08 15:58:13.830903,2026-07-08 15:58:13.830903,0 days 00:00:00,100,log2,5,2,COMPLETE
31,0.8018867924528302,2026-07-08 15:58:13.830903,2026-07-08 15:58:13.846693,0 days 00:00:00.015790,100,log2,5,2,COMPLETE
32,0.8018867924528302,2026-07-08 15:58:13.846693,2026-07-08 15:58:13.846693,0 days 00:00:00,100,log2,5,10,COMPLETE
33,0.8018867924528302,2026-07-08 15:58:13.846693,2026-07-08 15:58:13.846693,0 days 00:00:00,100,log2,5,2,COMPLETE
34,0.7358490566037735,2026-07-08 15:58:13.846693,2026-07-08 15:58:13.846693,0 days 00:00:00,100,sqrt,1,10,COMPLETE
35,0.7264150943396226,2026-07-08 15:58:13.846693,2026-07-08 15:58:13.862503,0 days 00:00:00.015810,1000,log2,1,2,COMPLETE
36,0.8018867924528302,2026-07-08 15:58:13.862503,2026-07-08 15:58:13.862503,0 days 00:00:00,100,sqrt,5,10,COMPLETE
37,0.8018867924528302,2026-07-08 15:58:13.862503,2026-07-08 15:58:13.862503,0 days 00:00:00,1000,sqrt,5,2,COMPLETE
38,0.7264150943396226,2026-07-08 15:58:13.862503,2026-07-08 15:58:13.862503,0 days 00:00:00,100,log2,1,2,COMPLETE
39,0.8018867924528302,2026-07-08 15:58:13.862503,2026-07-08 15:58:13.878320,0 days 00:00:00.015817,10,log2,5,2,COMPLETE
40,0.8018867924528302,2026-07-08 15:58:13.878320,2026-07-08 15:58:13.878320,0 days 00:00:00,1000,sqrt,5,10,COMPLETE
41,0.8018867924528302,2026-07-08 15:58:13.878320,2026-07-08 15:58:13.878320,0 days 00:00:00,1000,sqrt,5,10,COMPLETE
42,0.8018867924528302,2026-07-08 15:58:13.878320,2026-07-08 15:58:13.894127,0 days 00:00:00.015807,1000,sqrt,5,10,COMPLETE
43,0.8018867924528302,2026-07-08 15:58:13.894127,2026-07-08 15:58:13.894127,0 days 00:00:00,1000,sqrt,5,10,COMPLETE
44,0.8018867924528302,2026-07-08 15:58:13.894127,2026-07-08 15:58:13.894127,0 days 00:00:00,10,sqrt,5,10,COMPLETE
45,0.8018867924528302,2026-07-08 15:58:13.894127,2026-07-08 15:58:13.894127,0 days 00:00:00,1000,log2,5,2,COMPLETE
46,0.7264150943396226,2026-07-08 15:58:13.894127,2026-07-08 15:58:13.909898,0 days 00:00:00.015771,100,log2,1,2,COMPLETE
47,0.8018867924528302,2026-07-08 15:58:13.909898,2026-07-08 15:58:13.909898,0 days 00:00:00,10,log2,5,2,COMPLETE
48,0.8018867924528302,2026-07-08 15:58:13.909898,2026-07-08 15:58:13.909898,0 days 00:00:00,1000,sqrt,5,10,COMPLETE
49,0.8018867924528302,2026-07-08 15:58:13.909898,2026-07-08 15:58:13.909898,0 days 00:00:00,10,log2,5,2,COMPLETE
50,0.8018867924528302,2026-07-08 15:58:13.909898,2026-07-08 15:58:13.925714,0 days 00:00:00.015816,100,sqrt,5,2,COMPLETE
51,0.8018867924528302,2026-07-08 15:58:13.925714,2026-07-08 15:58:13.925714,0 days 00:00:00,1000,sqrt,5,2,COMPLETE
52,0.8018867924528302,2026-07-08 15:58:13.925714,2026-07-08 15:58:13.925714,0 days 00:00:00,1000,sqrt,5,2,COMPLETE
53,0.8018867924528302,2026-07-08 15:58:13.925714,2026-07-08 15:58:13.925714,0 days 00:00:00,1000,sqrt,5,2,COMPLETE
54,0.8018867924528302,2026-07-08 15:58:13.925714,2026-07-08 15:58:13.941507,0 days 00:00:00.015793,1000,sqrt,5,2,COMPLETE
55,0.8018867924528302,2026-07-08 15:58:13.941507,2026-07-08 15:58:13.941507,0 days 00:00:00,1000,log2,5,2,COMPLETE
56,0.8018867924528302,2026-07-08 15:58:13.941507,2026-07-08 15:58:13.941507,0 days 00:00:00,10,sqrt,5,2,COMPLETE
57,0.8018867924528302,2026-07-08 15:58:13.941507,2026-07-08 15:58:13.941507,0 days 00:00:00,100,log2,5,2,COMPLETE
58,0.7264150943396226,2026-07-08 15:58:13.957330,2026-07-08 15:58:13.957330,0 days 00:00:00,1000,log2,1,2,COMPLETE
59,0.8018867924528302,2026-07-08 15:58:13.957330,2026-07-08 15:58:13.957330,0 days 00:00:00,10,sqrt,5,10,COMPLETE
60,0.8018867924528302,2026-07-08 15:58:13.957330,2026-07-08 15:58:13.957330,0 days 00:00:00,100,log2,5,2,COMPLETE
61,0.8018867924528302,2026-07-08 15:58:13.957330,2026-07-08 15:58:13.973129,0 days 00:00:00.015799,10,log2,5,2,COMPLETE
62,0.8018867924528302,2026-07-08 15:58:13.973129,2026-07-08 15:58:13.973129,0 days 00:00:00,10,log2,5,2,COMPLETE
63,0.8018867924528302,2026-07-08 15:58:13.973129,2026-07-08 15:58:13.973129,0 days 00:00:00,10,log2,5,2,COMPLETE
64,0.8018867924528302,2026-07-08 15:58:13.973129,2026-07-08 15:58:13.973129,0 days 00:00:00,10,log2,5,2,COMPLETE
65,0.8018867924528302,2026-07-08 15:58:13.973129,2026-07-08 15:58:13.988953,0 days 00:00:00.015824,100,log2,5,2,COMPLETE
66,0.8018867924528302,2026-07-08 15:58:13.988953,2026-07-08 15:58:13.988953,0 days 00:00:00,1000,log2,5,2,COMPLETE
67,0.8018867924528302,2026-07-08 15:58:13.988953,2026-07-08 15:58:13.988953,0 days 00:00:00,10,sqrt,5,2,COMPLETE
68,0.7264150943396226,2026-07-08 15:58:13.988953,2026-07-08 15:58:14.004707,0 days 00:00:00.015754,100,log2,1,2,COMPLETE
69,0.8018867924528302,2026-07-08 15:58:14.004707,2026-07-08 15:58:14.004707,0 days 00:00:00,1000,sqrt,5,10,COMPLETE
70,0.8018867924528302,2026-07-08 15:58:14.004707,2026-07-08 15:58:14.004707,0 days 00:00:00,10,log2,5,2,COMPLETE
71,0.8018867924528302,2026-07-08 15:58:14.004707,2026-07-08 15:58:14.004707,0 days 00:00:00,10,log2,5,2,COMPLETE
72,0.8018867924528302,2026-07-08 15:58:14.004707,2026-07-08 15:58:14.020442,0 days 00:00:00.015735,10,log2,5,2,COMPLETE
73,0.8018867924528302,2026-07-08 15:58:14.020442,2026-07-08 15:58:14.020442,0 days 00:00:00,10,log2,5,2,COMPLETE
74,0.8018867924528302,2026-07-08 15:58:14.020442,2026-07-08 15:58:14.020442,0 days 00:00:00,100,log2,5,2,COMPLETE
75,0.8018867924528302,2026-07-08 15:58:14.020442,2026-07-08 15:58:14.036143,0 days 00:00:00.015701,10,log2,5,10,COMPLETE
76,0.8018867924528302,2026-07-08 15:58:14.036143,2026-07-08 15:58:14.036143,0 days 00:00:00,1000,sqrt,5,2,COMPLETE
77,0.8018867924528302,2026-07-08 15:58:14.036143,2026-07-08 15:58:14.036143,0 days 00:00:00,100,log2,5,2,COMPLETE
78,0.7830188679245284,2026-07-08 15:58:14.036143,2026-07-08 15:58:14.036143,0 days 00:00:00,10,sqrt,1,2,COMPLETE
79,0.8018867924528302,2026-07-08 15:58:14.036143,2026-07-08 15:58:14.052189,0 days 00:00:00.016046,1000,log2,5,10,COMPLETE
80,0.8018867924528302,2026-07-08 15:58:14.052189,2026-07-08 15:58:14.052189,0 days 00:00:00,1000,sqrt,5,2,COMPLETE
81,0.8018867924528302,2026-07-08 15:58:14.052189,2026-07-08 15:58:14.052189,0 days 00:00:00,10,log2,5,2,COMPLETE
82,0.8018867924528302,2026-07-08 15:58:14.052189,2026-07-08 15:58:14.067877,0 days 00:00:00.015688,10,log2,5,2,COMPLETE
83,0.8018867924528302,2026-07-08 15:58:14.067877,2026-07-08 15:58:14.067877,0 days 00:00:00,10,log2,5,2,COMPLETE
84,0.8018867924528302,2026-07-08 15:58:14.067877,2026-07-08 15:58:14.067877,0 days 00:00:00,10,log2,5,2,COMPLETE
85,0.8018867924528302,2026-07-08 15:58:14.067877,2026-07-08 15:58:14.083887,0 days 00:00:00.016010,100,log2,5,2,COMPLETE
86,0.8018867924528302,2026-07-08 15:58:14.083887,2026-07-08 15:58:14.083887,0 days 00:00:00,10,sqrt,5,2,COMPLETE
87,0.8018867924528302,2026-07-08 15:58:14.083887,2026-07-08 15:58:14.083887,0 days 00:00:00,1000,log2,5,10,COMPLETE
88,0.8018867924528302,2026-07-08 15:58:14.083887,2026-07-08 15:58:14.099899,0 days 00:00:00.016012,100,sqrt,5,2,COMPLETE
89,0.8018867924528302,2026-07-08 15:58:14.099899,2026-07-08 15:58:14.099899,0 days 00:00:00,10,log2,5,2,COMPLETE
90,0.7264150943396226,2026-07-08 15:58:14.099899,2026-07-08 15:58:14.099899,0 days 00:00:00,1000,log2,1,2,COMPLETE
91,0.8018867924528302,2026-07-08 15:58:14.099899,2026-07-08 15:58:14.099899,0 days 00:00:00,10,log2,5,2,COMPLETE
92,0.8018867924528302,2026-07-08 15:58:14.099899,2026-07-08 15:58:14.115765,0 days 00:00:00.015866,10,log2,5,2,COMPLETE
93,0.8018867924528302,2026-07-08 15:58:14.115765,2026-07-08 15:58:14.115765,0 days 00:00:00,10,log2,5,2,COMPLETE
94,0.8018867924528302,2026-07-08 15:58:14.115765,2026-07-08 15:58:14.131463,0 days 00:00:00.015698,10,log2,5,2,COMPLETE
95,0.8018867924528302,2026-07-08 15:58:14.131463,2026-07-08 15:58:14.131463,0 days 00:00:00,100,sqrt,5,2,COMPLETE
96,0.8018867924528302,2026-07-08 15:58:14.131463,2026-07-08 15:58:14.131463,0 days 00:00:00,1000,log2,5,10,COMPLETE
97,0.8018867924528302,2026-07-08 15:58:14.131463,2026-07-08 15:58:14.147303,0 days 00:00:00.015840,10,sqrt,5,2,COMPLETE
98,0.8018867924528302,2026-07-08 15:58:14.147303,2026-07-08 15:58:14.147303,0 days 00:00:00,10,log2,5,2,COMPLETE
99,0.8018867924528302,2026-07-08 15:58:14.147303,2026-07-08 15:58:14.163170,0 days 00:00:00.015867,1000,log2,5,2,COMPLETE
100,0.8018867924528302,2026-07-08 15:58:14.163170,2026-07-08 15:58:14.163170,0 days 00:00:00,100,sqrt,5,2,COMPLETE
101,0.8018867924528302,2026-07-08 15:58:14.163170,2026-07-08 15:58:14.178828,0 days 00:00:00.015658,100,log2,5,2,COMPLETE
102,0.8018867924528302,2026-07-08 15:58:14.178828,2026-07-08 15:58:14.178828,0 days 00:00:00,100,log2,5,2,COMPLETE
103,0.8018867924528302,2026-07-08 15:58:14.178828,2026-07-08 15:58:14.194917,0 days 00:00:00.016089,100,log2,5,2,COMPLETE
104,0.8018867924528302,2026-07-08 15:58:14.194917,2026-07-08 15:58:14.194917,0 days 00:00:00,100,log2,5,2,COMPLETE
105,0.8018867924528302,2026-07-08 15:58:14.194917,2026-07-08 15:58:14.210874,0 days 00:00:00.015957,10,log2,5,10,COMPLETE
106,0.7264150943396226,2026-07-08 15:58:14.210874,2026-07-08 15:58:14.210874,0 days 00:00:00,1000,log2,1,2,COMPLETE
107,0.8018867924528302,2026-07-08 15:58:14.210874,2026-07-08 15:58:14.226591,0 days 00:00:00.015717,100,sqrt,5,2,COMPLETE
108,0.8018867924528302,2026-07-08 15:58:14.226591,2026-07-08 15:58:14.226591,0 days 00:00:00,10,log2,5,2,COMPLETE
109,0.8018867924528302,2026-07-08 15:58:14.226591,2026-07-08 15:58:14.242323,0 days 00:00:00.015732,1000,log2,5,2,COMPLETE
110,0.8018867924528302,2026-07-08 15:58:14.242323,2026-07-08 15:58:14.242323,0 days 00:00:00,100,sqrt,5,10,COMPLETE
111,0.8018867924528302,2026-07-08 15:58:14.242323,2026-07-08 15:58:14.242323,0 days 00:00:00,10,log2,5,2,COMPLETE
112,0.8018867924528302,2026-07-08 15:58:14.242323,2026-07-08 15:58:14.258074,0 days 00:00:00.015751,10,log2,5,2,COMPLETE
113,0.8018867924528302,2026-07-08 15:58:14.258074,2026-07-08 15:58:14.258074,0 days 00:00:00,10,log2,5,2,COMPLETE
114,0.8018867924528302,2026-07-08 15:58:14.258074,2026-07-08 15:58:14.258074,0 days 00:00:00,10,log2,5,2,COMPLETE
115,0.8018867924528302,2026-07-08 15:58:14.258074,2026-07-08 15:58:14.273745,0 days 00:00:00.015671,10,log2,5,2,COMPLETE
116,0.8018867924528302,2026-07-08 15:58:14.273745,2026-07-08 15:58:14.273745,0 days 00:00:00,1000,log2,5,2,COMPLETE
117,0.8018867924528302,2026-07-08 15:58:14.273745,2026-07-08 15:58:14.289586,0 days 00:00:00.015841,10,sqrt,5,2,COMPLETE
118,0.8018867924528302,2026-07-08 15:58:14.289586,2026-07-08 15:58:14.289586,0 days 00:00:00,100,log2,5,2,COMPLETE
119,0.8018867924528302,2026-07-08 15:58:14.289586,2026-07-08 15:58:14.289586,0 days 00:00:00,10,log2,5,2,COMPLETE
120,0.7358490566037735,2026-07-08 15:58:14.289586,2026-07-08 15:58:14.305642,0 days 00:00:00.016056,1000,sqrt,1,10,COMPLETE
121,0.8018867924528302,2026-07-08 15:58:14.305642,2026-07-08 15:58:14.305642,0 days 00:00:00,100,log2,5,2,COMPLETE
122,0.8018867924528302,2026-07-08 15:58:14.305642,2026-07-08 15:58:14.305642,0 days 00:00:00,100,log2,5,2,COMPLETE
123,0.8018867924528302,2026-07-08 15:58:14.305642,2026-07-08 15:58:14.321310,0 days 00:00:00.015668,100,log2,5,2,COMPLETE
124,0.8018867924528302,2026-07-08 15:58:14.321310,2026-07-08 15:58:14.321310,0 days 00:00:00,100,log2,5,2,COMPLETE
125,0.8018867924528302,2026-07-08 15:58:14.321310,2026-07-08 15:58:14.321310,0 days 00:00:00,10,log2,5,2,COMPLETE
126,0.8018867924528302,2026-07-08 15:58:14.321310,2026-07-08 15:58:14.336975,0 days 00:00:00.015665,100,log2,5,2,COMPLETE
127,0.8018867924528302,2026-07-08 15:58:14.336975,2026-07-08 15:58:14.336975,0 days 00:00:00,1000,sqrt,5,2,COMPLETE
128,0.8018867924528302,2026-07-08 15:58:14.336975,2026-07-08 15:58:14.336975,0 days 00:00:00,10,log2,5,2,COMPLETE
129,0.8018867924528302,2026-07-08 15:58:14.352712,2026-07-08 15:58:14.352712,0 days 00:00:00,100,log2,5,2,COMPLETE
130,0.8018867924528302,2026-07-08 15:58:14.352712,2026-07-08 15:58:14.352712,0 days 00:00:00,10,sqrt,5,10,COMPLETE
131,0.8018867924528302,2026-07-08 15:58:14.352712,2026-07-08 15:58:14.368435,0 days 00:00:00.015723,100,log2,5,2,COMPLETE
132,0.8018867924528302,2026-07-08 15:58:14.368435,2026-07-08 15:58:14.368435,0 days 00:00:00,100,log2,5,2,COMPLETE
133,0.8018867924528302,2026-07-08 15:58:14.368435,2026-07-08 15:58:14.368435,0 days 00:00:00,100,log2,5,2,COMPLETE
134,0.8018867924528302,2026-07-08 15:58:14.368435,2026-07-08 15:58:14.384382,0 days 00:00:00.015947,100,log2,5,2,COMPLETE
135,0.8018867924528302,2026-07-08 15:58:14.384382,2026-07-08 15:58:14.391571,0 days 00:00:00.007189,1000,log2,5,2,COMPLETE
136,0.8018867924528302,2026-07-08 15:58:14.391571,2026-07-08 15:58:14.400425,0 days 00:00:00.008854,100,log2,5,2,COMPLETE
137,0.8018867924528302,2026-07-08 15:58:14.400425,2026-07-08 15:58:14.400425,0 days 00:00:00,10,log2,5,2,COMPLETE
138,0.7264150943396226,2026-07-08 15:58:14.400425,2026-07-08 15:58:14.400425,0 days 00:00:00,1000,sqrt,1,2,COMPLETE
139,0.8018867924528302,2026-07-08 15:58:14.400425,2026-07-08 15:58:14.416381,0 days 00:00:00.015956,10,log2,5,2,COMPLETE
140,0.8018867924528302,2026-07-08 15:58:14.416381,2026-07-08 15:58:14.416381,0 days 00:00:00,100,log2,5,10,COMPLETE
141,0.8018867924528302,2026-07-08 15:58:14.416381,2026-07-08 15:58:14.435184,0 days 00:00:00.018803,10,log2,5,2,COMPLETE
142,0.8018867924528302,2026-07-08 15:58:14.435184,2026-07-08 15:58:14.441210,0 days 00:00:00.006026,10,log2,5,2,COMPLETE
143,0.8018867924528302,2026-07-08 15:58:14.441210,2026-07-08 15:58:14.448246,0 days 00:00:00.007036,10,log2,5,2,COMPLETE
144,0.8018867924528302,2026-07-08 15:58:14.448246,2026-07-08 15:58:14.448246,0 days 00:00:00,10,log2,5,2,COMPLETE
145,0.8018867924528302,2026-07-08 15:58:14.448246,2026-07-08 15:58:14.464184,0 days 00:00:00.015938,10,log2,5,2,COMPLETE
146,0.8018867924528302,2026-07-08 15:58:14.464184,2026-07-08 15:58:14.464184,0 days 00:00:00,1000,sqrt,5,2,COMPLETE
147,0.8018867924528302,2026-07-08 15:58:14.464184,2026-07-08 15:58:14.480367,0 days 00:00:00.016183,10,log2,5,2,COMPLETE
148,0.8018867924528302,2026-07-08 15:58:14.480367,2026-07-08 15:58:14.480367,0 days 00:00:00,100,log2,5,2,COMPLETE
149,0.8018867924528302,2026-07-08 15:58:14.480367,2026-07-08 15:58:14.496135,0 days 00:00:00.015768,10,sqrt,5,2,COMPLETE
150,0.8018867924528302,2026-07-08 15:58:14.496135,2026-07-08 15:58:14.512263,0 days 00:00:00.016128,1000,log2,5,2,COMPLETE
151,0.8018867924528302,2026-07-08 15:58:14.512263,2026-07-08 15:58:14.512263,0 days 00:00:00,100,log2,5,2,COMPLETE
152,0.8018867924528302,2026-07-08 15:58:14.512263,2026-07-08 15:58:14.528134,0 days 00:00:00.015871,100,log2,5,2,COMPLETE
153,0.8018867924528302,2026-07-08 15:58:14.528134,2026-07-08 15:58:14.528134,0 days 00:00:00,100,log2,5,2,COMPLETE
154,0.8018867924528302,2026-07-08 15:58:14.528134,2026-07-08 15:58:14.543981,0 days 00:00:00.015847,100,log2,5,2,COMPLETE
155,0.8018867924528302,2026-07-08 15:58:14.543981,2026-07-08 15:58:14.543981,0 days 00:00:00,100,log2,5,10,COMPLETE
156,0.8018867924528302,2026-07-08 15:58:14.543981,2026-07-08 15:58:14.543981,0 days 00:00:00,10,log2,5,2,COMPLETE
157,0.8018867924528302,2026-07-08 15:58:14.559774,2026-07-08 15:58:14.559774,0 days 00:00:00,100,sqrt,5,2,COMPLETE
158,0.7264150943396226,2026-07-08 15:58:14.559774,2026-07-08 15:58:14.559774,0 days 00:00:00,1000,log2,1,2,COMPLETE
159,0.8018867924528302,2026-07-08 15:58:14.559774,2026-07-08 15:58:14.559774,0 days 00:00:00,10,log2,5,2,COMPLETE
160,0.8018867924528302,2026-07-08 15:58:14.559774,2026-07-08 15:58:14.575522,0 days 00:00:00.015748,100,log2,5,2,COMPLETE
161,0.8018867924528302,2026-07-08 15:58:14.575522,2026-07-08 15:58:14.575522,0 days 00:00:00,1000,sqrt,5,2,COMPLETE
162,0.8018867924528302,2026-07-08 15:58:14.575522,2026-07-08 15:58:14.591173,0 days 00:00:00.015651,1000,sqrt,5,2,COMPLETE
163,0.8018867924528302,2026-07-08 15:58:14.591173,2026-07-08 15:58:14.591173,0 days 00:00:00,1000,sqrt,5,2,COMPLETE
164,0.8018867924528302,2026-07-08 15:58:14.591173,2026-07-08 15:58:14.606978,0 days 00:00:00.015805,1000,sqrt,5,2,COMPLETE
165,0.8018867924528302,2026-07-08 15:58:14.606978,2026-07-08 15:58:14.606978,0 days 00:00:00,1000,sqrt,5,2,COMPLETE
166,0.8018867924528302,2026-07-08 15:58:14.606978,2026-07-08 15:58:14.622657,0 days 00:00:00.015679,10,log2,5,10,COMPLETE
167,0.8018867924528302,2026-07-08 15:58:14.622657,2026-07-08 15:58:14.638506,0 days 00:00:00.015849,100,sqrt,5,2,COMPLETE
168,0.8018867924528302,2026-07-08 15:58:14.638506,2026-07-08 15:58:14.638506,0 days 00:00:00,10,log2,5,2,COMPLETE
169,0.8018867924528302,2026-07-08 15:58:14.638506,2026-07-08 15:58:14.638506,0 days 00:00:00,1000,log2,5,2,COMPLETE
170,0.8018867924528302,2026-07-08 15:58:14.638506,2026-07-08 15:58:14.654580,0 days 00:00:00.016074,100,log2,5,2,COMPLETE
171,0.8018867924528302,2026-07-08 15:58:14.654580,2026-07-08 15:58:14.670263,0 days 00:00:00.015683,1000,sqrt,5,2,COMPLETE
172,0.8018867924528302,2026-07-08 15:58:14.670263,2026-07-08 15:58:14.670263,0 days 00:00:00,1000,sqrt,5,2,COMPLETE
173,0.8018867924528302,2026-07-08 15:58:14.670263,2026-07-08 15:58:14.670263,0 days 00:00:00,1000,sqrt,5,2,COMPLETE
174,0.8018867924528302,2026-07-08 15:58:14.670263,2026-07-08 15:58:14.686064,0 days 00:00:00.015801,1000,sqrt,5,2,COMPLETE
175,0.8018867924528302,2026-07-08 15:58:14.686064,2026-07-08 15:58:14.686064,0 days 00:00:00,10,sqrt,5,2,COMPLETE
176,0.8018867924528302,2026-07-08 15:58:14.686064,2026-07-08 15:58:14.686064,0 days 00:00:00,1000,log2,5,2,COMPLETE
177,0.8018867924528302,2026-07-08 15:58:14.686064,2026-07-08 15:58:14.702185,0 days 00:00:00.016121,10,sqrt,5,2,COMPLETE
178,0.8018867924528302,2026-07-08 15:58:14.702185,2026-07-08 15:58:14.702185,0 days 00:00:00,100,log2,5,10,COMPLETE
179,0.8018867924528302,2026-07-08 15:58:14.702185,2026-07-08 15:58:14.718133,0 days 00:00:00.015948,10,log2,5,2,COMPLETE
180,0.8018867924528302,2026-07-08 15:58:14.718133,2026-07-08 15:58:14.718133,0 days 00:00:00,100,log2,5,2,COMPLETE
181,0.8018867924528302,2026-07-08 15:58:14.718133,2026-07-08 15:58:14.734332,0 days 00:00:00.016199,1000,sqrt,5,2,COMPLETE
182,0.8018867924528302,2026-07-08 15:58:14.734332,2026-07-08 15:58:14.734332,0 days 00:00:00,1000,sqrt,5,2,COMPLETE
183,0.8018867924528302,2026-07-08 15:58:14.734332,2026-07-08 15:58:14.750226,0 days 00:00:00.015894,1000,sqrt,5,2,COMPLETE
