number,value,datetime_start,datetime_complete,duration,params_booster,params_learning_rate,params_max_delta_step,params_min_child_weight,params_random_state,state
0,0.7993959224767179,2026-07-13 19:13:49.747406,2026-07-13 19:13:49.863729,0 days 00:00:00.116323,gbtree,0.05,0,1,42,COMPLETE
1,0.7100427888245658,2026-07-13 19:13:49.863729,2026-07-13 19:13:49.889245,0 days 00:00:00.025516,gblinear,0.05,0,1,42,COMPLETE
2,0.8089604832620186,2026-07-13 19:13:49.889245,2026-07-13 19:13:51.074784,0 days 00:00:01.185539,dart,0.1,0,1,42,COMPLETE
3,0.7993959224767179,2026-07-13 19:13:51.074784,2026-07-13 19:13:52.314279,0 days 00:00:01.239495,dart,0.05,0,1,42,COMPLETE
4,0.8089604832620186,2026-07-13 19:13:52.314279,2026-07-13 19:13:52.383415,0 days 00:00:00.069136,gbtree,0.1,0,1,42,COMPLETE
5,0.8089604832620186,2026-07-13 19:13:52.383415,2026-07-13 19:13:52.448754,0 days 00:00:00.065339,gbtree,0.1,0,1,42,COMPLETE
6,0.7100427888245658,2026-07-13 19:13:52.448754,2026-07-13 19:13:52.476286,0 days 00:00:00.027532,gblinear,0.05,0,1,42,COMPLETE
7,0.7993959224767179,2026-07-13 19:13:52.476286,2026-07-13 19:13:52.545362,0 days 00:00:00.069076,gbtree,0.05,0,1,42,COMPLETE
8,0.7165869619934558,2026-07-13 19:13:52.545362,2026-07-13 19:13:52.572883,0 days 00:00:00.027521,gblinear,0.1,0,1,42,COMPLETE
9,0.7165869619934558,2026-07-13 19:13:52.572883,2026-07-13 19:13:52.600408,0 days 00:00:00.027525,gblinear,0.1,0,1,42,COMPLETE
10,0.8089604832620186,2026-07-13 19:13:52.600408,2026-07-13 19:13:53.855176,0 days 00:00:01.254768,dart,0.1,0,1,42,COMPLETE
11,0.8089604832620186,2026-07-13 19:13:53.856918,2026-07-13 19:13:55.157560,0 days 00:00:01.300642,dart,0.1,0,1,42,COMPLETE
12,0.8089604832620186,2026-07-13 19:13:55.157560,2026-07-13 19:13:56.384052,0 days 00:00:01.226492,dart,0.1,0,1,42,COMPLETE
13,0.8089604832620186,2026-07-13 19:13:56.384052,2026-07-13 19:13:56.452621,0 days 00:00:00.068569,gbtree,0.1,0,1,42,COMPLETE
14,0.8089604832620186,2026-07-13 19:13:56.452621,2026-07-13 19:13:57.700263,0 days 00:00:01.247642,dart,0.1,0,1,42,COMPLETE
15,0.8089604832620186,2026-07-13 19:13:57.700263,2026-07-13 19:13:57.765411,0 days 00:00:00.065148,gbtree,0.1,0,1,42,COMPLETE
16,0.8089604832620186,2026-07-13 19:13:57.765411,2026-07-13 19:13:59.001474,0 days 00:00:01.236063,dart,0.1,0,1,42,COMPLETE
17,0.8089604832620186,2026-07-13 19:13:59.001474,2026-07-13 19:13:59.066647,0 days 00:00:00.065173,gbtree,0.1,0,1,42,COMPLETE
18,0.8089604832620186,2026-07-13 19:13:59.066647,2026-07-13 19:14:00.356331,0 days 00:00:01.289684,dart,0.1,0,1,42,COMPLETE
19,0.8089604832620186,2026-07-13 19:14:00.356331,2026-07-13 19:14:00.421464,0 days 00:00:00.065133,gbtree,0.1,0,1,42,COMPLETE
20,0.8089604832620186,2026-07-13 19:14:00.421464,2026-07-13 19:14:01.666016,0 days 00:00:01.244552,dart,0.1,0,1,42,COMPLETE
21,0.8089604832620186,2026-07-13 19:14:01.666016,2026-07-13 19:14:01.731405,0 days 00:00:00.065389,gbtree,0.1,0,1,42,COMPLETE
22,0.8089604832620186,2026-07-13 19:14:01.731405,2026-07-13 19:14:01.795931,0 days 00:00:00.064526,gbtree,0.1,0,1,42,COMPLETE
23,0.8089604832620186,2026-07-13 19:14:01.795931,2026-07-13 19:14:01.861221,0 days 00:00:00.065290,gbtree,0.1,0,1,42,COMPLETE
24,0.8089604832620186,2026-07-13 19:14:01.863229,2026-07-13 19:14:01.926260,0 days 00:00:00.063031,gbtree,0.1,0,1,42,COMPLETE
25,0.8089604832620186,2026-07-13 19:14:01.928003,2026-07-13 19:14:01.991241,0 days 00:00:00.063238,gbtree,0.1,0,1,42,COMPLETE
26,0.7993959224767179,2026-07-13 19:14:01.991241,2026-07-13 19:14:02.060316,0 days 00:00:00.069075,gbtree,0.05,0,1,42,COMPLETE
27,0.8089604832620186,2026-07-13 19:14:02.060316,2026-07-13 19:14:02.123816,0 days 00:00:00.063500,gbtree,0.1,0,1,42,COMPLETE
28,0.7165869619934558,2026-07-13 19:14:02.123816,2026-07-13 19:14:02.150823,0 days 00:00:00.027007,gblinear,0.1,0,1,42,COMPLETE
29,0.7993959224767179,2026-07-13 19:14:02.150823,2026-07-13 19:14:03.368744,0 days 00:00:01.217921,dart,0.05,0,1,42,COMPLETE
30,0.8089604832620186,2026-07-13 19:14:03.368744,2026-07-13 19:14:03.437733,0 days 00:00:00.068989,gbtree,0.1,0,1,42,COMPLETE
31,0.8089604832620186,2026-07-13 19:14:03.437733,2026-07-13 19:14:04.676763,0 days 00:00:01.239030,dart,0.1,0,1,42,COMPLETE
32,0.8089604832620186,2026-07-13 19:14:04.676763,2026-07-13 19:14:05.961712,0 days 00:00:01.284949,dart,0.1,0,1,42,COMPLETE
33,0.8089604832620186,2026-07-13 19:14:05.961712,2026-07-13 19:14:07.209941,0 days 00:00:01.248229,dart,0.1,0,1,42,COMPLETE
34,0.7993959224767179,2026-07-13 19:14:07.209941,2026-07-13 19:14:08.490110,0 days 00:00:01.280169,dart,0.05,0,1,42,COMPLETE
35,0.7993959224767179,2026-07-13 19:14:08.490110,2026-07-13 19:14:09.748826,0 days 00:00:01.258716,dart,0.05,0,1,42,COMPLETE
36,0.7165869619934558,2026-07-13 19:14:09.748826,2026-07-13 19:14:09.776353,0 days 00:00:00.027527,gblinear,0.1,0,1,42,COMPLETE
37,0.8089604832620186,2026-07-13 19:14:09.776353,2026-07-13 19:14:11.014760,0 days 00:00:01.238407,dart,0.1,0,1,42,COMPLETE
38,0.7100427888245658,2026-07-13 19:14:11.014760,2026-07-13 19:14:11.042022,0 days 00:00:00.027262,gblinear,0.05,0,1,42,COMPLETE
39,0.8089604832620186,2026-07-13 19:14:11.042022,2026-07-13 19:14:11.107488,0 days 00:00:00.065466,gbtree,0.1,0,1,42,COMPLETE
40,0.8089604832620186,2026-07-13 19:14:11.107488,2026-07-13 19:14:12.387148,0 days 00:00:01.279660,dart,0.1,0,1,42,COMPLETE
41,0.8089604832620186,2026-07-13 19:14:12.388891,2026-07-13 19:14:13.575880,0 days 00:00:01.186989,dart,0.1,0,1,42,COMPLETE
42,0.8089604832620186,2026-07-13 19:14:13.577882,2026-07-13 19:14:14.826848,0 days 00:00:01.248966,dart,0.1,0,1,42,COMPLETE
43,0.8089604832620186,2026-07-13 19:14:14.826848,2026-07-13 19:14:16.077974,0 days 00:00:01.251126,dart,0.1,0,1,42,COMPLETE
44,0.8089604832620186,2026-07-13 19:14:16.077974,2026-07-13 19:14:17.341462,0 days 00:00:01.263488,dart,0.1,0,1,42,COMPLETE
45,0.8089604832620186,2026-07-13 19:14:17.343464,2026-07-13 19:14:18.578362,0 days 00:00:01.234898,dart,0.1,0,1,42,COMPLETE
46,0.7165869619934558,2026-07-13 19:14:18.578362,2026-07-13 19:14:18.606136,0 days 00:00:00.027774,gblinear,0.1,0,1,42,COMPLETE
47,0.8089604832620186,2026-07-13 19:14:18.606136,2026-07-13 19:14:18.671154,0 days 00:00:00.065018,gbtree,0.1,0,1,42,COMPLETE
48,0.8089604832620186,2026-07-13 19:14:18.671154,2026-07-13 19:14:19.914940,0 days 00:00:01.243786,dart,0.1,0,1,42,COMPLETE
49,0.7993959224767179,2026-07-13 19:14:19.914940,2026-07-13 19:14:19.983993,0 days 00:00:00.069053,gbtree,0.05,0,1,42,COMPLETE
50,0.8089604832620186,2026-07-13 19:14:19.985995,2026-07-13 19:14:21.234515,0 days 00:00:01.248520,dart,0.1,0,1,42,COMPLETE
51,0.8089604832620186,2026-07-13 19:14:21.234515,2026-07-13 19:14:22.492383,0 days 00:00:01.257868,dart,0.1,0,1,42,COMPLETE
52,0.8089604832620186,2026-07-13 19:14:22.492383,2026-07-13 19:14:23.734995,0 days 00:00:01.242612,dart,0.1,0,1,42,COMPLETE
53,0.8089604832620186,2026-07-13 19:14:23.734995,2026-07-13 19:14:24.977346,0 days 00:00:01.242351,dart,0.1,0,1,42,COMPLETE
54,0.8089604832620186,2026-07-13 19:14:24.979349,2026-07-13 19:14:25.044134,0 days 00:00:00.064785,gbtree,0.1,0,1,42,COMPLETE
55,0.8089604832620186,2026-07-13 19:14:25.044134,2026-07-13 19:14:26.310959,0 days 00:00:01.266825,dart,0.1,0,1,42,COMPLETE
56,0.8089604832620186,2026-07-13 19:14:26.310959,2026-07-13 19:14:26.376362,0 days 00:00:00.065403,gbtree,0.1,0,1,42,COMPLETE
57,0.8089604832620186,2026-07-13 19:14:26.376362,2026-07-13 19:14:27.605704,0 days 00:00:01.229342,dart,0.1,0,1,42,COMPLETE
58,0.8089604832620186,2026-07-13 19:14:27.605704,2026-07-13 19:14:27.672899,0 days 00:00:00.067195,gbtree,0.1,0,1,42,COMPLETE
59,0.7165869619934558,2026-07-13 19:14:27.672899,2026-07-13 19:14:27.702163,0 days 00:00:00.029264,gblinear,0.1,0,1,42,COMPLETE
60,0.8089604832620186,2026-07-13 19:14:27.702163,2026-07-13 19:14:28.890283,0 days 00:00:01.188120,dart,0.1,0,1,42,COMPLETE
61,0.8089604832620186,2026-07-13 19:14:28.890283,2026-07-13 19:14:28.957199,0 days 00:00:00.066916,gbtree,0.1,0,1,42,COMPLETE
62,0.8089604832620186,2026-07-13 19:14:28.957199,2026-07-13 19:14:29.020229,0 days 00:00:00.063030,gbtree,0.1,0,1,42,COMPLETE
63,0.8089604832620186,2026-07-13 19:14:29.020229,2026-07-13 19:14:29.086752,0 days 00:00:00.066523,gbtree,0.1,0,1,42,COMPLETE
64,0.8089604832620186,2026-07-13 19:14:29.086752,2026-07-13 19:14:29.151578,0 days 00:00:00.064826,gbtree,0.1,0,1,42,COMPLETE
65,0.7993959224767179,2026-07-13 19:14:29.151578,2026-07-13 19:14:29.218616,0 days 00:00:00.067038,gbtree,0.05,0,1,42,COMPLETE
66,0.8089604832620186,2026-07-13 19:14:29.218616,2026-07-13 19:14:29.283700,0 days 00:00:00.065084,gbtree,0.1,0,1,42,COMPLETE
67,0.8089604832620186,2026-07-13 19:14:29.283700,2026-07-13 19:14:30.564061,0 days 00:00:01.280361,dart,0.1,0,1,42,COMPLETE
68,0.8089604832620186,2026-07-13 19:14:30.564061,2026-07-13 19:14:30.627094,0 days 00:00:00.063033,gbtree,0.1,0,1,42,COMPLETE
69,0.8089604832620186,2026-07-13 19:14:30.627094,2026-07-13 19:14:31.887815,0 days 00:00:01.260721,dart,0.1,0,1,42,COMPLETE
70,0.7165869619934558,2026-07-13 19:14:31.887815,2026-07-13 19:14:31.915618,0 days 00:00:00.027803,gblinear,0.1,0,1,42,COMPLETE
71,0.8089604832620186,2026-07-13 19:14:31.915618,2026-07-13 19:14:33.173229,0 days 00:00:01.257611,dart,0.1,0,1,42,COMPLETE
72,0.8089604832620186,2026-07-13 19:14:33.173229,2026-07-13 19:14:34.442384,0 days 00:00:01.269155,dart,0.1,0,1,42,COMPLETE
73,0.8089604832620186,2026-07-13 19:14:34.442384,2026-07-13 19:14:35.708243,0 days 00:00:01.265859,dart,0.1,0,1,42,COMPLETE
74,0.8089604832620186,2026-07-13 19:14:35.708243,2026-07-13 19:14:37.032984,0 days 00:00:01.324741,dart,0.1,0,1,42,COMPLETE
75,0.7993959224767179,2026-07-13 19:14:37.034726,2026-07-13 19:14:38.313466,0 days 00:00:01.278740,dart,0.05,0,1,42,COMPLETE
76,0.8089604832620186,2026-07-13 19:14:38.315468,2026-07-13 19:14:38.380416,0 days 00:00:00.064948,gbtree,0.1,0,1,42,COMPLETE
77,0.8089604832620186,2026-07-13 19:14:38.380416,2026-07-13 19:14:39.628457,0 days 00:00:01.248041,dart,0.1,0,1,42,COMPLETE
78,0.8089604832620186,2026-07-13 19:14:39.628457,2026-07-13 19:14:40.889912,0 days 00:00:01.261455,dart,0.1,0,1,42,COMPLETE
79,0.8089604832620186,2026-07-13 19:14:40.889912,2026-07-13 19:14:40.955533,0 days 00:00:00.065621,gbtree,0.1,0,1,42,COMPLETE
80,0.8089604832620186,2026-07-13 19:14:40.956046,2026-07-13 19:14:42.147272,0 days 00:00:01.191226,dart,0.1,0,1,42,COMPLETE
81,0.8089604832620186,2026-07-13 19:14:42.147272,2026-07-13 19:14:42.214657,0 days 00:00:00.067385,gbtree,0.1,0,1,42,COMPLETE
82,0.8089604832620186,2026-07-13 19:14:42.214657,2026-07-13 19:14:42.281445,0 days 00:00:00.066788,gbtree,0.1,0,1,42,COMPLETE
83,0.8089604832620186,2026-07-13 19:14:42.281445,2026-07-13 19:14:42.348709,0 days 00:00:00.067264,gbtree,0.1,0,1,42,COMPLETE
84,0.8089604832620186,2026-07-13 19:14:42.348709,2026-07-13 19:14:42.417195,0 days 00:00:00.068486,gbtree,0.1,0,1,42,COMPLETE
85,0.7993959224767179,2026-07-13 19:14:42.417195,2026-07-13 19:14:43.662811,0 days 00:00:01.245616,dart,0.05,0,1,42,COMPLETE
86,0.8089604832620186,2026-07-13 19:14:43.664813,2026-07-13 19:14:43.729599,0 days 00:00:00.064786,gbtree,0.1,0,1,42,COMPLETE
87,0.7165869619934558,2026-07-13 19:14:43.729599,2026-07-13 19:14:43.755426,0 days 00:00:00.025827,gblinear,0.1,0,1,42,COMPLETE
88,0.8089604832620186,2026-07-13 19:14:43.757166,2026-07-13 19:14:45.002941,0 days 00:00:01.245775,dart,0.1,0,1,42,COMPLETE
89,0.8089604832620186,2026-07-13 19:14:45.002941,2026-07-13 19:14:45.068169,0 days 00:00:00.065228,gbtree,0.1,0,1,42,COMPLETE
90,0.8089604832620186,2026-07-13 19:14:45.068169,2026-07-13 19:14:46.316387,0 days 00:00:01.248218,dart,0.1,0,1,42,COMPLETE
91,0.8089604832620186,2026-07-13 19:14:46.316387,2026-07-13 19:14:47.570270,0 days 00:00:01.253883,dart,0.1,0,1,42,COMPLETE
92,0.8089604832620186,2026-07-13 19:14:47.570270,2026-07-13 19:14:48.866300,0 days 00:00:01.296030,dart,0.1,0,1,42,COMPLETE
93,0.8089604832620186,2026-07-13 19:14:48.866300,2026-07-13 19:14:50.105477,0 days 00:00:01.239177,dart,0.1,0,1,42,COMPLETE
94,0.8089604832620186,2026-07-13 19:14:50.105477,2026-07-13 19:14:51.353963,0 days 00:00:01.248486,dart,0.1,0,1,42,COMPLETE
95,0.8089604832620186,2026-07-13 19:14:51.353963,2026-07-13 19:14:51.420788,0 days 00:00:00.066825,gbtree,0.1,0,1,42,COMPLETE
96,0.8089604832620186,2026-07-13 19:14:51.420788,2026-07-13 19:14:52.643832,0 days 00:00:01.223044,dart,0.1,0,1,42,COMPLETE
97,0.8089604832620186,2026-07-13 19:14:52.645834,2026-07-13 19:14:53.916414,0 days 00:00:01.270580,dart,0.1,0,1,42,COMPLETE
98,0.7993959224767179,2026-07-13 19:14:53.916414,2026-07-13 19:14:53.987715,0 days 00:00:00.071301,gbtree,0.05,0,1,42,COMPLETE
99,0.8089604832620186,2026-07-13 19:14:53.989459,2026-07-13 19:14:55.239249,0 days 00:00:01.249790,dart,0.1,0,1,42,COMPLETE
100,0.7165869619934558,2026-07-13 19:14:55.241251,2026-07-13 19:14:55.268770,0 days 00:00:00.027519,gblinear,0.1,0,1,42,COMPLETE
101,0.8089604832620186,2026-07-13 19:14:55.268770,2026-07-13 19:14:55.331993,0 days 00:00:00.063223,gbtree,0.1,0,1,42,COMPLETE
102,0.8089604832620186,2026-07-13 19:14:55.331993,2026-07-13 19:14:55.398773,0 days 00:00:00.066780,gbtree,0.1,0,1,42,COMPLETE
103,0.8089604832620186,2026-07-13 19:14:55.398773,2026-07-13 19:14:55.463931,0 days 00:00:00.065158,gbtree,0.1,0,1,42,COMPLETE
104,0.8089604832620186,2026-07-13 19:14:55.463931,2026-07-13 19:14:55.528710,0 days 00:00:00.064779,gbtree,0.1,0,1,42,COMPLETE
105,0.8089604832620186,2026-07-13 19:14:55.528710,2026-07-13 19:14:55.595749,0 days 00:00:00.067039,gbtree,0.1,0,1,42,COMPLETE
106,0.8089604832620186,2026-07-13 19:14:55.595749,2026-07-13 19:14:56.893617,0 days 00:00:01.297868,dart,0.1,0,1,42,COMPLETE
107,0.8089604832620186,2026-07-13 19:14:56.893617,2026-07-13 19:14:56.956656,0 days 00:00:00.063039,gbtree,0.1,0,1,42,COMPLETE
108,0.8089604832620186,2026-07-13 19:14:56.958398,2026-07-13 19:14:58.210936,0 days 00:00:01.252538,dart,0.1,0,1,42,COMPLETE
109,0.8089604832620186,2026-07-13 19:14:58.212938,2026-07-13 19:14:58.278244,0 days 00:00:00.065306,gbtree,0.1,0,1,42,COMPLETE
110,0.8089604832620186,2026-07-13 19:14:58.278244,2026-07-13 19:14:59.547847,0 days 00:00:01.269603,dart,0.1,0,1,42,COMPLETE
111,0.8089604832620186,2026-07-13 19:14:59.547847,2026-07-13 19:15:00.826544,0 days 00:00:01.278697,dart,0.1,0,1,42,COMPLETE
112,0.8089604832620186,2026-07-13 19:15:00.826544,2026-07-13 19:15:02.036981,0 days 00:00:01.210437,dart,0.1,0,1,42,COMPLETE
113,0.8089604832620186,2026-07-13 19:15:02.036981,2026-07-13 19:15:03.312339,0 days 00:00:01.275358,dart,0.1,0,1,42,COMPLETE
114,0.8089604832620186,2026-07-13 19:15:03.312339,2026-07-13 19:15:04.500676,0 days 00:00:01.188337,dart,0.1,0,1,42,COMPLETE
115,0.7993959224767179,2026-07-13 19:15:04.500676,2026-07-13 19:15:05.757056,0 days 00:00:01.256380,dart,0.05,0,1,42,COMPLETE
116,0.8089604832620186,2026-07-13 19:15:05.757056,2026-07-13 19:15:05.821873,0 days 00:00:00.064817,gbtree,0.1,0,1,42,COMPLETE
117,0.8089604832620186,2026-07-13 19:15:05.823879,2026-07-13 19:15:07.083627,0 days 00:00:01.259748,dart,0.1,0,1,42,COMPLETE
118,0.8089604832620186,2026-07-13 19:15:07.083627,2026-07-13 19:15:07.148732,0 days 00:00:00.065105,gbtree,0.1,0,1,42,COMPLETE
119,0.8089604832620186,2026-07-13 19:15:07.148732,2026-07-13 19:15:08.397975,0 days 00:00:01.249243,dart,0.1,0,1,42,COMPLETE
120,0.7165869619934558,2026-07-13 19:15:08.397975,2026-07-13 19:15:08.425270,0 days 00:00:00.027295,gblinear,0.1,0,1,42,COMPLETE
121,0.8089604832620186,2026-07-13 19:15:08.425270,2026-07-13 19:15:08.488588,0 days 00:00:00.063318,gbtree,0.1,0,1,42,COMPLETE
122,0.8089604832620186,2026-07-13 19:15:08.488588,2026-07-13 19:15:08.557724,0 days 00:00:00.069136,gbtree,0.1,0,1,42,COMPLETE
123,0.8089604832620186,2026-07-13 19:15:08.557724,2026-07-13 19:15:08.624327,0 days 00:00:00.066603,gbtree,0.1,0,1,42,COMPLETE
124,0.8089604832620186,2026-07-13 19:15:08.624327,2026-07-13 19:15:08.688515,0 days 00:00:00.064188,gbtree,0.1,0,1,42,COMPLETE
125,0.8089604832620186,2026-07-13 19:15:08.688515,2026-07-13 19:15:08.753921,0 days 00:00:00.065406,gbtree,0.1,0,1,42,COMPLETE
126,0.8089604832620186,2026-07-13 19:15:08.755923,2026-07-13 19:15:10.103677,0 days 00:00:01.347754,dart,0.1,0,1,42,COMPLETE
127,0.8089604832620186,2026-07-13 19:15:10.103677,2026-07-13 19:15:10.175518,0 days 00:00:00.071841,gbtree,0.1,0,1,42,COMPLETE
128,0.8089604832620186,2026-07-13 19:15:10.175518,2026-07-13 19:15:11.480580,0 days 00:00:01.305062,dart,0.1,0,1,42,COMPLETE
129,0.7993959224767179,2026-07-13 19:15:11.480580,2026-07-13 19:15:12.845595,0 days 00:00:01.365015,dart,0.05,0,1,42,COMPLETE
130,0.8089604832620186,2026-07-13 19:15:12.845595,2026-07-13 19:15:12.925602,0 days 00:00:00.080007,gbtree,0.1,0,1,42,COMPLETE
131,0.8089604832620186,2026-07-13 19:15:12.925602,2026-07-13 19:15:14.280097,0 days 00:00:01.354495,dart,0.1,0,1,42,COMPLETE
132,0.8089604832620186,2026-07-13 19:15:14.280097,2026-07-13 19:15:15.574768,0 days 00:00:01.294671,dart,0.1,0,1,42,COMPLETE
133,0.8089604832620186,2026-07-13 19:15:15.574768,2026-07-13 19:15:16.857618,0 days 00:00:01.282850,dart,0.1,0,1,42,COMPLETE
134,0.8089604832620186,2026-07-13 19:15:16.859620,2026-07-13 19:15:18.158599,0 days 00:00:01.298979,dart,0.1,0,1,42,COMPLETE
135,0.8089604832620186,2026-07-13 19:15:18.160601,2026-07-13 19:15:19.472118,0 days 00:00:01.311517,dart,0.1,0,1,42,COMPLETE
136,0.8089604832620186,2026-07-13 19:15:19.472118,2026-07-13 19:15:19.537278,0 days 00:00:00.065160,gbtree,0.1,0,1,42,COMPLETE
137,0.8089604832620186,2026-07-13 19:15:19.537278,2026-07-13 19:15:20.791801,0 days 00:00:01.254523,dart,0.1,0,1,42,COMPLETE
138,0.8089604832620186,2026-07-13 19:15:20.791801,2026-07-13 19:15:20.856814,0 days 00:00:00.065013,gbtree,0.1,0,1,42,COMPLETE
139,0.7165869619934558,2026-07-13 19:15:20.858816,2026-07-13 19:15:20.884342,0 days 00:00:00.025526,gblinear,0.1,0,1,42,COMPLETE
140,0.8089604832620186,2026-07-13 19:15:20.886344,2026-07-13 19:15:22.141507,0 days 00:00:01.255163,dart,0.1,0,1,42,COMPLETE
141,0.8089604832620186,2026-07-13 19:15:22.141507,2026-07-13 19:15:22.210379,0 days 00:00:00.068872,gbtree,0.1,0,1,42,COMPLETE
142,0.8089604832620186,2026-07-13 19:15:22.210379,2026-07-13 19:15:22.279622,0 days 00:00:00.069243,gbtree,0.1,0,1,42,COMPLETE
143,0.8089604832620186,2026-07-13 19:15:22.279622,2026-07-13 19:15:22.344237,0 days 00:00:00.064615,gbtree,0.1,0,1,42,COMPLETE
144,0.8089604832620186,2026-07-13 19:15:22.344237,2026-07-13 19:15:22.409035,0 days 00:00:00.064798,gbtree,0.1,0,1,42,COMPLETE
145,0.8089604832620186,2026-07-13 19:15:22.409035,2026-07-13 19:15:22.475798,0 days 00:00:00.066763,gbtree,0.1,0,1,42,COMPLETE
146,0.8089604832620186,2026-07-13 19:15:22.475798,2026-07-13 19:15:23.744409,0 days 00:00:01.268611,dart,0.1,0,1,42,COMPLETE
147,0.8089604832620186,2026-07-13 19:15:23.744409,2026-07-13 19:15:23.807771,0 days 00:00:00.063362,gbtree,0.1,0,1,42,COMPLETE
148,0.8089604832620186,2026-07-13 19:15:23.809773,2026-07-13 19:15:25.088526,0 days 00:00:01.278753,dart,0.1,0,1,42,COMPLETE
149,0.8089604832620186,2026-07-13 19:15:25.088526,2026-07-13 19:15:26.318200,0 days 00:00:01.229674,dart,0.1,0,1,42,COMPLETE
150,0.7993959224767179,2026-07-13 19:15:26.318200,2026-07-13 19:15:26.389463,0 days 00:00:00.071263,gbtree,0.05,0,1,42,COMPLETE
151,0.8089604832620186,2026-07-13 19:15:26.389463,2026-07-13 19:15:26.455835,0 days 00:00:00.066372,gbtree,0.1,0,1,42,COMPLETE
152,0.8089604832620186,2026-07-13 19:15:26.455835,2026-07-13 19:15:26.521137,0 days 00:00:00.065302,gbtree,0.1,0,1,42,COMPLETE
153,0.8089604832620186,2026-07-13 19:15:26.521137,2026-07-13 19:15:26.584812,0 days 00:00:00.063675,gbtree,0.1,0,1,42,COMPLETE
154,0.8089604832620186,2026-07-13 19:15:26.584812,2026-07-13 19:15:26.649617,0 days 00:00:00.064805,gbtree,0.1,0,1,42,COMPLETE
155,0.8089604832620186,2026-07-13 19:15:26.650913,2026-07-13 19:15:26.716212,0 days 00:00:00.065299,gbtree,0.1,0,1,42,COMPLETE
156,0.8089604832620186,2026-07-13 19:15:26.716212,2026-07-13 19:15:28.007203,0 days 00:00:01.290991,dart,0.1,0,1,42,COMPLETE
157,0.8089604832620186,2026-07-13 19:15:28.007203,2026-07-13 19:15:29.253406,0 days 00:00:01.246203,dart,0.1,0,1,42,COMPLETE
158,0.8089604832620186,2026-07-13 19:15:29.253406,2026-07-13 19:15:29.320629,0 days 00:00:00.067223,gbtree,0.1,0,1,42,COMPLETE
159,0.8089604832620186,2026-07-13 19:15:29.320629,2026-07-13 19:15:30.573676,0 days 00:00:01.253047,dart,0.1,0,1,42,COMPLETE
160,0.8089604832620186,2026-07-13 19:15:30.575678,2026-07-13 19:15:30.639949,0 days 00:00:00.064271,gbtree,0.1,0,1,42,COMPLETE
161,0.8089604832620186,2026-07-13 19:15:30.639949,2026-07-13 19:15:30.706250,0 days 00:00:00.066301,gbtree,0.1,0,1,42,COMPLETE
162,0.8089604832620186,2026-07-13 19:15:30.706250,2026-07-13 19:15:30.777035,0 days 00:00:00.070785,gbtree,0.1,0,1,42,COMPLETE
163,0.8089604832620186,2026-07-13 19:15:30.777035,2026-07-13 19:15:30.845848,0 days 00:00:00.068813,gbtree,0.1,0,1,42,COMPLETE
164,0.8089604832620186,2026-07-13 19:15:30.845848,2026-07-13 19:15:30.912403,0 days 00:00:00.066555,gbtree,0.1,0,1,42,COMPLETE
165,0.8089604832620186,2026-07-13 19:15:30.912403,2026-07-13 19:15:32.101181,0 days 00:00:01.188778,dart,0.1,0,1,42,COMPLETE
166,0.7165869619934558,2026-07-13 19:15:32.102923,2026-07-13 19:15:32.128815,0 days 00:00:00.025892,gblinear,0.1,0,1,42,COMPLETE
167,0.8089604832620186,2026-07-13 19:15:32.128815,2026-07-13 19:15:32.193910,0 days 00:00:00.065095,gbtree,0.1,0,1,42,COMPLETE
168,0.8089604832620186,2026-07-13 19:15:32.193910,2026-07-13 19:15:33.496831,0 days 00:00:01.302921,dart,0.1,0,1,42,COMPLETE
169,0.7993959224767179,2026-07-13 19:15:33.496831,2026-07-13 19:15:33.565872,0 days 00:00:00.069041,gbtree,0.05,0,1,42,COMPLETE
170,0.8089604832620186,2026-07-13 19:15:33.565872,2026-07-13 19:15:34.818722,0 days 00:00:01.252850,dart,0.1,0,1,42,COMPLETE
